{
  "counts": {
    "by_kind": {
      "ARCHITECTURAL_LEARNING": 9,
      "AUTONOMY_RULE": 2,
      "COMMIT_STRATEGY": 5,
      "CONTEXT_MANAGEMENT_PATTERN": 1,
      "COST_RESULT_EVIDENCE": 1,
      "MODEL_SELECTION_HEURISTIC": 1,
      "OPERATOR_INTERVENTION_PATTERN": 1,
      "PATTERN": 3,
      "PRINCIPLE": 3,
      "RECOVERY_PATTERN": 1,
      "STOP_CONDITION": 2,
      "TASK_DECOMPOSITION_PATTERN": 4,
      "TEST_STRATEGY": 4,
      "VALIDATION_RULE": 1
    },
    "by_status": {
      "CANDIDATE": 22,
      "PROMOTED": 7,
      "VALIDATED": 9
    },
    "total": 38
  },
  "items": {
    "already_compliant_do_not_invent_change": {
      "kind": "PRINCIPLE",
      "knowledge_version": "0.1.0",
      "learning_origin": "DEVELOPMENT_ORIGIN",
      "path": "items/already_compliant_do_not_invent_change.json",
      "privacy_class": "ia_core_internal",
      "scope": "IA_CORE_BUILD",
      "status": "VALIDATED",
      "tags": [
        "audit",
        "scope"
      ]
    },
    "apparent_frontier_can_be_designed_away": {
      "kind": "TASK_DECOMPOSITION_PATTERN",
      "knowledge_version": "0.1.0",
      "learning_origin": "DEVELOPMENT_ORIGIN",
      "path": "items/apparent_frontier_can_be_designed_away.json",
      "privacy_class": "ia_core_internal",
      "scope": "IA_CORE_BUILD",
      "status": "CANDIDATE",
      "tags": [
        "planning",
        "compression"
      ]
    },
    "autonomous_wall_time_per_usage": {
      "kind": "PATTERN",
      "knowledge_version": "0.1.0",
      "learning_origin": "DEVELOPMENT_ORIGIN",
      "path": "items/autonomous_wall_time_per_usage.json",
      "privacy_class": "ia_core_internal",
      "scope": "IA_CORE_BUILD",
      "status": "CANDIDATE",
      "tags": [
        "metrics",
        "wall_time",
        "usage",
        "measurement_quality"
      ]
    },
    "callable_chain_is_not_authorized_route": {
      "kind": "ARCHITECTURAL_LEARNING",
      "knowledge_version": "0.1.0",
      "learning_origin": "DEVELOPMENT_ORIGIN",
      "path": "items/callable_chain_is_not_authorized_route.json",
      "privacy_class": "ia_core_internal",
      "scope": "IA_CORE_BUILD",
      "status": "CANDIDATE",
      "tags": [
        "authorization",
        "provider_boundary",
        "runtime_boundary"
      ]
    },
    "commit_repair_needs_explicit_parity": {
      "kind": "COMMIT_STRATEGY",
      "knowledge_version": "0.1.0",
      "learning_origin": "DEVELOPMENT_ORIGIN",
      "path": "items/commit_repair_needs_explicit_parity.json",
      "privacy_class": "ia_core_internal",
      "scope": "IA_CORE_BUILD",
      "status": "CANDIDATE",
      "tags": [
        "git",
        "commits",
        "accountability",
        "repair",
        "parity"
      ]
    },
    "compile_human_decisions_into_packages": {
      "kind": "TASK_DECOMPOSITION_PATTERN",
      "knowledge_version": "0.1.0",
      "learning_origin": "DEVELOPMENT_ORIGIN",
      "path": "items/compile_human_decisions_into_packages.json",
      "privacy_class": "ia_core_internal",
      "scope": "IA_CORE_BUILD",
      "status": "VALIDATED",
      "tags": [
        "decisions",
        "packages"
      ]
    },
    "compress_occurrences_into_decisions": {
      "kind": "TASK_DECOMPOSITION_PATTERN",
      "knowledge_version": "0.1.0",
      "learning_origin": "DEVELOPMENT_ORIGIN",
      "path": "items/compress_occurrences_into_decisions.json",
      "privacy_class": "ia_core_internal",
      "scope": "IA_CORE_BUILD",
      "status": "PROMOTED",
      "tags": [
        "decision_units",
        "compression"
      ]
    },
    "conditioned_autonomy": {
      "kind": "AUTONOMY_RULE",
      "knowledge_version": "0.1.0",
      "learning_origin": "DEVELOPMENT_ORIGIN",
      "path": "items/conditioned_autonomy.json",
      "privacy_class": "ia_core_internal",
      "scope": "IA_CORE_BUILD",
      "status": "VALIDATED",
      "tags": [
        "autonomy",
        "stop"
      ]
    },
    "context_continuity_reduces_rework": {
      "kind": "CONTEXT_MANAGEMENT_PATTERN",
      "knowledge_version": "0.1.0",
      "learning_origin": "DEVELOPMENT_ORIGIN",
      "path": "items/context_continuity_reduces_rework.json",
      "privacy_class": "ia_core_internal",
      "scope": "IA_CORE_BUILD",
      "status": "CANDIDATE",
      "tags": [
        "context",
        "continuity"
      ]
    },
    "contract_exists_is_not_route_adapter": {
      "kind": "ARCHITECTURAL_LEARNING",
      "knowledge_version": "0.1.0",
      "learning_origin": "DEVELOPMENT_ORIGIN",
      "path": "items/contract_exists_is_not_route_adapter.json",
      "privacy_class": "ia_core_internal",
      "scope": "IA_CORE_BUILD",
      "status": "CANDIDATE",
      "tags": [
        "canonical",
        "legacy_api",
        "coverage"
      ]
    },
    "contract_over_ui_inference": {
      "kind": "PRINCIPLE",
      "knowledge_version": "0.1.0",
      "learning_origin": "DEVELOPMENT_ORIGIN",
      "path": "items/contract_over_ui_inference.json",
      "privacy_class": "ia_core_internal",
      "scope": "IA_CORE_BUILD",
      "status": "VALIDATED",
      "tags": [
        "contract",
        "security",
        "ui_boundary"
      ]
    },
    "contract_precision_multiplies_verified_scope": {
      "kind": "ARCHITECTURAL_LEARNING",
      "knowledge_version": "0.1.0",
      "learning_origin": "DEVELOPMENT_ORIGIN",
      "path": "items/contract_precision_multiplies_verified_scope.json",
      "privacy_class": "ia_core_internal",
      "scope": "IA_CORE_BUILD",
      "status": "CANDIDATE",
      "tags": [
        "contracts",
        "scope",
        "evidence",
        "governance"
      ]
    },
    "controlled_assembled_block_execution": {
      "kind": "PATTERN",
      "knowledge_version": "0.1.0",
      "learning_origin": "DEVELOPMENT_ORIGIN",
      "path": "items/controlled_assembled_block_execution.json",
      "privacy_class": "ia_core_internal",
      "scope": "IA_CORE_BUILD",
      "status": "VALIDATED",
      "tags": [
        "execution",
        "stations",
        "gates"
      ]
    },
    "cost_per_correctly_closed_surface": {
      "kind": "COST_RESULT_EVIDENCE",
      "knowledge_version": "0.1.0",
      "learning_origin": "DEVELOPMENT_ORIGIN",
      "path": "items/cost_per_correctly_closed_surface.json",
      "privacy_class": "ia_core_internal",
      "scope": "IA_CORE_BUILD",
      "status": "CANDIDATE",
      "tags": [
        "metrics",
        "cost"
      ]
    },
    "derive_service_owner_before_destination": {
      "kind": "ARCHITECTURAL_LEARNING",
      "knowledge_version": "0.1.0",
      "learning_origin": "DEVELOPMENT_ORIGIN",
      "path": "items/derive_service_owner_before_destination.json",
      "privacy_class": "ia_core_internal",
      "scope": "IA_CORE_BUILD",
      "status": "CANDIDATE",
      "tags": [
        "owner",
        "route_boundary",
        "frontier"
      ]
    },
    "deterministic_distance_defines_block_size": {
      "kind": "TASK_DECOMPOSITION_PATTERN",
      "knowledge_version": "0.1.0",
      "learning_origin": "DEVELOPMENT_ORIGIN",
      "path": "items/deterministic_distance_defines_block_size.json",
      "privacy_class": "ia_core_internal",
      "scope": "IA_CORE_BUILD",
      "status": "CANDIDATE",
      "tags": [
        "planning",
        "block_size"
      ]
    },
    "evidence_before_closure": {
      "kind": "VALIDATION_RULE",
      "knowledge_version": "0.1.0",
      "learning_origin": "DEVELOPMENT_ORIGIN",
      "path": "items/evidence_before_closure.json",
      "privacy_class": "ia_core_internal",
      "scope": "IA_CORE_BUILD",
      "status": "PROMOTED",
      "tags": [
        "evidence",
        "closure"
      ]
    },
    "focal_group_canonical_deep_test_policy": {
      "kind": "TEST_STRATEGY",
      "knowledge_version": "0.1.0",
      "learning_origin": "DEVELOPMENT_ORIGIN",
      "path": "items/focal_group_canonical_deep_test_policy.json",
      "privacy_class": "ia_core_internal",
      "scope": "IA_CORE_BUILD",
      "status": "PROMOTED",
      "tags": [
        "tests",
        "quality"
      ]
    },
    "historical_checkpoint_requires_evidence_endpoint": {
      "kind": "TEST_STRATEGY",
      "knowledge_version": "0.1.0",
      "learning_origin": "DEVELOPMENT_ORIGIN",
      "path": "items/historical_checkpoint_requires_evidence_endpoint.json",
      "privacy_class": "ia_core_internal",
      "scope": "IA_CORE_BUILD",
      "status": "CANDIDATE",
      "tags": [
        "tests",
        "historical",
        "checkpoints",
        "evidence",
        "contract"
      ]
    },
    "human_intervention_is_high_value_resource": {
      "kind": "OPERATOR_INTERVENTION_PATTERN",
      "knowledge_version": "0.1.0",
      "learning_origin": "DEVELOPMENT_ORIGIN",
      "path": "items/human_intervention_is_high_value_resource.json",
      "privacy_class": "ia_core_internal",
      "scope": "IA_CORE_BUILD",
      "status": "CANDIDATE",
      "tags": [
        "operator",
        "compression"
      ]
    },
    "internal_gates": {
      "kind": "AUTONOMY_RULE",
      "knowledge_version": "0.1.0",
      "learning_origin": "DEVELOPMENT_ORIGIN",
      "path": "items/internal_gates.json",
      "privacy_class": "ia_core_internal",
      "scope": "IA_CORE_BUILD",
      "status": "VALIDATED",
      "tags": [
        "gates",
        "continuity"
      ]
    },
    "legacy_write_needs_boundary_proof": {
      "kind": "ARCHITECTURAL_LEARNING",
      "knowledge_version": "0.1.0",
      "learning_origin": "DEVELOPMENT_ORIGIN",
      "path": "items/legacy_write_needs_boundary_proof.json",
      "privacy_class": "ia_core_internal",
      "scope": "IA_CORE_BUILD",
      "status": "CANDIDATE",
      "tags": [
        "persistence",
        "sandbox",
        "rollback"
      ]
    },
    "local_rollback": {
      "kind": "RECOVERY_PATTERN",
      "knowledge_version": "0.1.0",
      "learning_origin": "DEVELOPMENT_ORIGIN",
      "path": "items/local_rollback.json",
      "privacy_class": "ia_core_internal",